{
  "$schema": "https://json-schema.org/draft/2020-12/schema",
  "$id": "https://schemas.pawnkit.dev/pawn-project/v1/schema.json",
  "title": "Pawn project manifest (pawn.json / pawn.yaml)",
  "description": "A Pawn project manifest compatible with sampctl and PawnKit.",
  "type": "object",
  "properties": {
    "entry": { "type": "string", "minLength": 1, "description": "The .pwn file to compile." },
    "output": { "type": "string", "minLength": 1, "description": "Destination path for the compiled .amx." },
    "user": { "type": "string" },
    "repo": { "type": "string" },
    "dependencies": {
      "type": "array",
      "items": { "$ref": "#/$defs/dependencyString" }
    },
    "dev_dependencies": {
      "type": "array",
      "items": { "$ref": "#/$defs/dependencyString" }
    },
    "preset": { "type": "string", "enum": ["samp", "openmp"] },
    "local": { "type": "boolean", "default": false },
    "include_path": { "type": "string" },
    "resources": {
      "type": "array",
      "description": "Release files and archives used by plugin and component packages.",
      "items": { "$ref": "#/$defs/resource" }
    },
    "extract_ignore_patterns": {
      "type": "array",
      "items": { "type": "string" }
    },
    "contributors": {
      "type": "array",
      "items": {
        "oneOf": [
          { "type": "string" },
          {
            "type": "object",
            "properties": {
              "name": { "type": "string" },
              "email": { "type": "string" }
            },
            "additionalProperties": true
          }
        ]
      }
    },
    "website": { "type": "string" },
    "experimental": {
      "type": "object",
      "properties": {
        "build_file": { "type": "boolean", "default": true }
      },
      "additionalProperties": true
    },
    "build": { "$ref": "#/$defs/build" },
    "builds": {
      "type": "array",
      "items": { "allOf": [{ "$ref": "#/$defs/build" }, { "required": ["name"] }] }
    },
    "runtime": { "$ref": "#/$defs/runtime" },
    "runtimes": {
      "type": "array",
      "items": { "allOf": [{ "$ref": "#/$defs/runtime" }, { "required": ["name"] }] }
    },
    "pawnkit": {
      "type": "object",
      "description": "Settings used by PawnKit tools.",
      "required": ["schemaVersion"],
      "properties": {
        "schemaVersion": { "type": "integer", "const": 1 },
        "profile": {
          "type": "string",
          "pattern": "^[a-z][a-z0-9-]*$",
          "description": "Target profile. This overrides the profile inferred from preset."
        },
        "includePaths": {
          "type": "array",
          "items": { "type": "string" },
          "description": "Extra include directories."
        },
        "dependencyOverrides": {
          "type": "object",
          "description": "Root-only replacements for obsolete transitive dependencies.",
          "propertyNames": { "$ref": "#/$defs/dependencyIdentity" },
          "additionalProperties": { "$ref": "#/$defs/dependencyString" }
        },
        "tests": {
          "type": "object",
          "description": "Settings passed to pawntest.",
          "additionalProperties": true
        },
        "tool": {
          "type": "object",
          "description": "Settings grouped by tool name, such as pawnlint.",
          "additionalProperties": { "type": "object" }
        },
        "lockfile": {
          "type": "string",
          "default": "pawn.lock",
          "description": "Path to the project lockfile."
        }
      },
      "additionalProperties": false
    }
  },
  "additionalProperties": true,
  "$defs": {
    "resource": {
      "type": "object",
      "required": ["name", "platform"],
      "properties": {
        "name": { "type": "string", "minLength": 1 },
        "platform": { "type": "string", "minLength": 1 },
        "version": { "type": "string" },
        "archive": { "type": "boolean", "default": false },
        "includes": { "type": "array", "items": { "type": "string" } },
        "plugins": { "type": "array", "items": { "type": "string" } },
        "files": {
          "type": "object",
          "additionalProperties": { "type": "string" }
        }
      },
      "additionalProperties": true
    },
    "dependencyString": {
      "type": "string",
      "description": "Package in user/repo or HTTPS host/user/repo form, with an optional kind and version reference.",
      "pattern": "^(?:(?:plugin://|component://|includes://|filterscript://)?[A-Za-z0-9_.-]+/[A-Za-z0-9_.-]+|https://[A-Za-z0-9.-]+/[A-Za-z0-9_.-]+/[A-Za-z0-9_.-]+)([:#@].+)?$"
    },
    "dependencyIdentity": {
      "type": "string",
      "description": "Package identity without a version reference.",
      "pattern": "^(?:(?:plugin://|component://|includes://|filterscript://)?[A-Za-z0-9_.-]+/[A-Za-z0-9_.-]+|https://[A-Za-z0-9.-]+/[A-Za-z0-9_.-]+/[A-Za-z0-9_.-]+)$"
    },
    "build": {
      "type": "object",
      "properties": {
        "name": { "type": "string" },
        "args": { "type": "array", "items": { "type": "string" } },
        "constants": { "type": "object", "additionalProperties": { "type": ["string", "number", "boolean"] } },
        "compiler": {
          "type": "object",
          "properties": {
            "site": { "type": "string" },
            "user": { "type": "string" },
            "repo": { "type": "string" },
            "version": { "type": "string" }
          },
          "additionalProperties": true
        },
        "input": { "type": "string" },
        "output": { "type": "string" },
        "includes": { "type": "array", "items": { "type": "string" } }
      },
      "additionalProperties": true
    },
    "runtime": {
      "type": "object",
      "description": "Server runtime settings using sampctl field names.",
      "properties": {
        "name": { "type": "string" },
        "version": { "type": "string" },
        "endpoint": { "type": "string" },
        "mode": { "type": "string" },
        "extra": { "type": "object", "additionalProperties": true },
        "gamemodes": { "type": "array", "items": { "type": "string" } },
        "rcon_password": { "type": "string" },
        "announce": { "type": "boolean" },
        "maxplayers": { "type": "integer" },
        "port": { "type": "integer" },
        "lanmode": { "type": "boolean" },
        "query": { "type": "boolean" },
        "rcon": { "type": "boolean" },
        "logqueries": { "type": "boolean" },
        "stream_rate": { "type": "integer" },
        "stream_distance": { "type": "number" },
        "sleep": { "type": ["string", "integer"] },
        "maxnpc": { "type": "integer" },
        "onfoot_rate": { "type": "integer" },
        "incar_rate": { "type": "integer" },
        "weapon_rate": { "type": "integer" },
        "chatlogging": { "type": "boolean" },
        "timestamp": { "type": "boolean" },
        "bind": { "type": "string" },
        "password": { "type": "string" },
        "hostname": { "type": "string" },
        "language": { "type": "string" },
        "mapname": { "type": "string" },
        "weburl": { "type": "string" },
        "gamemodetext": { "type": "string" },
        "filterscripts": { "type": "array", "items": { "type": "string" } },
        "plugins": { "type": "array", "items": { "type": "string" } },
        "nosign": { "type": "string" },
        "logtimeformat": { "type": "string" },
        "messageholelimit": { "type": "integer" },
        "messageslimit": { "type": "integer" },
        "ackslimit": { "type": "integer" },
        "playertimeout": { "type": "integer" },
        "minconnectiontime": { "type": "integer" },
        "lagcompmode": { "type": "integer" },
        "connseedtime": { "type": "integer" },
        "db_logging": { "type": "boolean" },
        "db_log_queries": { "type": "boolean" },
        "conncookies": { "type": "boolean" },
        "cookielogging": { "type": "boolean" }
      },
      "additionalProperties": true
    }
  }
}
